{
  "records": true,
  "entered_by": "assistant",
  "reviewed_by_human": false,
  "last_updated": "2025-10-07",
  "source": {
    "book": "Book 01 - PH"
  },
  "record_log": [
    {
      "entry_keys": [
        "Introduction Entity"
      ],
      "added_by": "assistant",
      "date": "2025-10-07",
      "method": "manual_seed",
      "review_status": "pending"
    }
  ]
}
